{
  "claim_boundary": "Scenario artifacts are evidence, not visual regression baselines or accessibility certification.",
  "component_id": "button",
  "passes": [
    {
      "artifact": {
        "path": "runtime/editorial-action-disabled-busy.png",
        "byte_length": 3009,
        "media_type": "image/png",
        "sha256": "sha256:4b3df5ceab968c2808b21319b8b7694a723db61dd11cf6c3173664604f4e3776",
        "height": 56,
        "width": 640
      },
      "channel": "visual",
      "environment": {
        "browser": "Google Chrome for Testing 149.0.7827.55",
        "browser_revision": "chromium-1228",
        "container_image": "local-host:25.5.0",
        "kind": "browser",
        "lockfile_sha256": "sha256:f57973ff40f27c7f545f94e9529b61fcc95d8521662f7e3ea3a2ece392dfc86e",
        "node": "v22.23.1",
        "platform": "darwin/arm64",
        "playwright": "1.61.0",
        "viewport": "1024x768"
      },
      "id": "action-disabled-busy-visual",
      "recorded_at": "2026-07-13T17:57:27.692Z",
      "result": {
        "observed": "Recorded visual evidence for action-disabled-busy; this is not certification.",
        "status": "passed"
      },
      "run": {
        "attempt": 1,
        "id": "bcf6a47e-1588-496e-b15c-1c5669539eee",
        "repository": "changeroa/StyleGallery",
        "revision": "bb772d303c9dafea6e99d2c5713b4bd66e41a3bb",
        "source": "local"
      },
      "scenario_id": "action-disabled-busy",
      "session": {
        "attempt": 1,
        "branch": "codex/roadmap-05-state-evidence",
        "environment": {
          "browser": "Google Chrome for Testing 149.0.7827.55",
          "browser_revision": "chromium-1228",
          "container_image": "local-host:25.5.0",
          "kind": "browser",
          "lockfile_sha256": "sha256:f57973ff40f27c7f545f94e9529b61fcc95d8521662f7e3ea3a2ece392dfc86e",
          "node": "v22.23.1",
          "platform": "darwin/arm64",
          "playwright": "1.61.0",
          "viewport": "1024x768"
        },
        "nonce": "a19a4fa9ad541d3d7ddc757435b2718c210733c1d070fea65d8db55ec7195346",
        "receipt_sha256": "sha256:2db986d79bed5928fdbc531e6884eca8d6ff37299fcdbfb794ab33cf5db85740",
        "revision": "bb772d303c9dafea6e99d2c5713b4bd66e41a3bb",
        "session_id": "bcf6a47e-1588-496e-b15c-1c5669539eee",
        "started_at": "2026-07-13T17:57:26.704Z"
      },
      "scope": {
        "component": "button",
        "semantic_mode": "action",
        "state_set": [
          "busy",
          "disabled"
        ]
      }
    },
    {
      "artifact": {
        "path": "runtime/editorial-action-disabled-busy.dom.json",
        "byte_length": 1286,
        "media_type": "application/json",
        "sha256": "sha256:bd67134d1f292882bf43891e9f81c6e542d0b977e2c445c5713352915324854a"
      },
      "channel": "dom",
      "environment": {
        "browser": "Google Chrome for Testing 149.0.7827.55",
        "browser_revision": "chromium-1228",
        "container_image": "local-host:25.5.0",
        "kind": "browser",
        "lockfile_sha256": "sha256:f57973ff40f27c7f545f94e9529b61fcc95d8521662f7e3ea3a2ece392dfc86e",
        "node": "v22.23.1",
        "platform": "darwin/arm64",
        "playwright": "1.61.0",
        "viewport": "1024x768"
      },
      "id": "action-disabled-busy-dom",
      "recorded_at": "2026-07-13T17:57:27.692Z",
      "result": {
        "observed": "Recorded dom evidence for action-disabled-busy; this is not certification.",
        "status": "passed"
      },
      "run": {
        "attempt": 1,
        "id": "bcf6a47e-1588-496e-b15c-1c5669539eee",
        "repository": "changeroa/StyleGallery",
        "revision": "bb772d303c9dafea6e99d2c5713b4bd66e41a3bb",
        "source": "local"
      },
      "scenario_id": "action-disabled-busy",
      "session": {
        "attempt": 1,
        "branch": "codex/roadmap-05-state-evidence",
        "environment": {
          "browser": "Google Chrome for Testing 149.0.7827.55",
          "browser_revision": "chromium-1228",
          "container_image": "local-host:25.5.0",
          "kind": "browser",
          "lockfile_sha256": "sha256:f57973ff40f27c7f545f94e9529b61fcc95d8521662f7e3ea3a2ece392dfc86e",
          "node": "v22.23.1",
          "platform": "darwin/arm64",
          "playwright": "1.61.0",
          "viewport": "1024x768"
        },
        "nonce": "a19a4fa9ad541d3d7ddc757435b2718c210733c1d070fea65d8db55ec7195346",
        "receipt_sha256": "sha256:2db986d79bed5928fdbc531e6884eca8d6ff37299fcdbfb794ab33cf5db85740",
        "revision": "bb772d303c9dafea6e99d2c5713b4bd66e41a3bb",
        "session_id": "bcf6a47e-1588-496e-b15c-1c5669539eee",
        "started_at": "2026-07-13T17:57:26.704Z"
      },
      "scope": {
        "component": "button",
        "semantic_mode": "action",
        "state_set": [
          "busy",
          "disabled"
        ]
      }
    },
    {
      "artifact": {
        "path": "runtime/editorial-action-disabled-busy.ax.json",
        "byte_length": 1205,
        "media_type": "application/json",
        "sha256": "sha256:b16fb9faa7cd29423426510c450f01e1e1a24830a29936c4cce3de08812450f7"
      },
      "channel": "ax",
      "environment": {
        "browser": "Google Chrome for Testing 149.0.7827.55",
        "browser_revision": "chromium-1228",
        "container_image": "local-host:25.5.0",
        "kind": "browser",
        "lockfile_sha256": "sha256:f57973ff40f27c7f545f94e9529b61fcc95d8521662f7e3ea3a2ece392dfc86e",
        "node": "v22.23.1",
        "platform": "darwin/arm64",
        "playwright": "1.61.0",
        "viewport": "1024x768"
      },
      "id": "action-disabled-busy-ax",
      "recorded_at": "2026-07-13T17:57:27.692Z",
      "result": {
        "observed": "Recorded ax evidence for action-disabled-busy; this is not certification.",
        "status": "passed"
      },
      "run": {
        "attempt": 1,
        "id": "bcf6a47e-1588-496e-b15c-1c5669539eee",
        "repository": "changeroa/StyleGallery",
        "revision": "bb772d303c9dafea6e99d2c5713b4bd66e41a3bb",
        "source": "local"
      },
      "scenario_id": "action-disabled-busy",
      "session": {
        "attempt": 1,
        "branch": "codex/roadmap-05-state-evidence",
        "environment": {
          "browser": "Google Chrome for Testing 149.0.7827.55",
          "browser_revision": "chromium-1228",
          "container_image": "local-host:25.5.0",
          "kind": "browser",
          "lockfile_sha256": "sha256:f57973ff40f27c7f545f94e9529b61fcc95d8521662f7e3ea3a2ece392dfc86e",
          "node": "v22.23.1",
          "platform": "darwin/arm64",
          "playwright": "1.61.0",
          "viewport": "1024x768"
        },
        "nonce": "a19a4fa9ad541d3d7ddc757435b2718c210733c1d070fea65d8db55ec7195346",
        "receipt_sha256": "sha256:2db986d79bed5928fdbc531e6884eca8d6ff37299fcdbfb794ab33cf5db85740",
        "revision": "bb772d303c9dafea6e99d2c5713b4bd66e41a3bb",
        "session_id": "bcf6a47e-1588-496e-b15c-1c5669539eee",
        "started_at": "2026-07-13T17:57:26.704Z"
      },
      "scope": {
        "component": "button",
        "semantic_mode": "action",
        "state_set": [
          "busy",
          "disabled"
        ]
      }
    },
    {
      "artifact": {
        "path": "runtime/editorial-action-focused.png",
        "byte_length": 1695,
        "media_type": "image/png",
        "sha256": "sha256:ad888e0f6eb4f57cb020672af3965e33245330af2c6547247d60bb9a4080afeb",
        "height": 56,
        "width": 640
      },
      "channel": "visual",
      "environment": {
        "browser": "Google Chrome for Testing 149.0.7827.55",
        "browser_revision": "chromium-1228",
        "container_image": "local-host:25.5.0",
        "kind": "browser",
        "lockfile_sha256": "sha256:f57973ff40f27c7f545f94e9529b61fcc95d8521662f7e3ea3a2ece392dfc86e",
        "node": "v22.23.1",
        "platform": "darwin/arm64",
        "playwright": "1.61.0",
        "viewport": "1024x768"
      },
      "id": "action-focused-visual",
      "recorded_at": "2026-07-13T17:57:27.806Z",
      "result": {
        "observed": "Recorded visual evidence for action-focused; this is not certification.",
        "status": "passed"
      },
      "run": {
        "attempt": 1,
        "id": "bcf6a47e-1588-496e-b15c-1c5669539eee",
        "repository": "changeroa/StyleGallery",
        "revision": "bb772d303c9dafea6e99d2c5713b4bd66e41a3bb",
        "source": "local"
      },
      "scenario_id": "action-focused",
      "session": {
        "attempt": 1,
        "branch": "codex/roadmap-05-state-evidence",
        "environment": {
          "browser": "Google Chrome for Testing 149.0.7827.55",
          "browser_revision": "chromium-1228",
          "container_image": "local-host:25.5.0",
          "kind": "browser",
          "lockfile_sha256": "sha256:f57973ff40f27c7f545f94e9529b61fcc95d8521662f7e3ea3a2ece392dfc86e",
          "node": "v22.23.1",
          "platform": "darwin/arm64",
          "playwright": "1.61.0",
          "viewport": "1024x768"
        },
        "nonce": "a19a4fa9ad541d3d7ddc757435b2718c210733c1d070fea65d8db55ec7195346",
        "receipt_sha256": "sha256:2db986d79bed5928fdbc531e6884eca8d6ff37299fcdbfb794ab33cf5db85740",
        "revision": "bb772d303c9dafea6e99d2c5713b4bd66e41a3bb",
        "session_id": "bcf6a47e-1588-496e-b15c-1c5669539eee",
        "started_at": "2026-07-13T17:57:26.704Z"
      },
      "scope": {
        "component": "button",
        "semantic_mode": "action",
        "state_set": [
          "focus"
        ]
      }
    },
    {
      "artifact": {
        "path": "runtime/editorial-action-focused.dom.json",
        "byte_length": 1226,
        "media_type": "application/json",
        "sha256": "sha256:a3322569c6304e5d73943ec8f2217d7edeff588d517cb00daed018b9d9bd2add"
      },
      "channel": "dom",
      "environment": {
        "browser": "Google Chrome for Testing 149.0.7827.55",